"Title","DateAdded","PaperRank","Domain","Authors","Year","DOI","PrimaryURL","Access","AbstractMini","WhyRelevant","Owner"
"Process ramanomics: single-cell Raman spectroscopy workflow for rapid monitoring of beer fermentation phenotypes","17/03/2026 7:18","7","[""Analytics & Digital""]","Liu Yang et al. (QIBEBT, Chinese Academy of Sciences)","2026","10.1016/j.biortech.2025.133788","https://phys.org/news/2026-01-beer-fermentation-cell-raman-method.html","[""OPEN""]","Develops a ""process ramanomics"" workflow using spontaneous single-cell Raman spectroscopy to predict 19 extracellular phenotypes (higher alcohols, esters, amino acids, sugars) during industrial lager fermentation, revealing cell-to-cell metabolic heterogeneity.","Pioneers label-free, single-cell PAT for brewing; links intracellular Raman fingerprints to conventional fermentation QC metrics, advancing real-time process monitoring beyond bulk methods.","JORDI ROYES BUISAN"
"Synergistic toughening of biomass poly(ethylene furanoate) with CO2-derived poly(butylene carbonate) for sustainable materials","09/03/2026 17:12","6","[""Materials & Packaging""]","Bo Wang; Yunfei Wu; Lipeng Liu; Liyang Wang; Zhicheng Qiu; Zhiyong Li; Xu Qiu; Chang Xu; Xijing Zhuang","2026","10.1016/j.mtsust.2026.101324","https://www.sciencedirect.com/science/article/pii/S2589234726000254","[""OPEN""]","Estudio experimental que mejora la tenacidad/compatibilidad de PEF mediante blending con PBC derivado de CO2, abordando fragilidad del PEF.","Relevante para packaging/biomateriales: rutas de formulación para mejorar performance sin perder narrativa de sostenibilidad.","PABLO TEJERO TRAPIELLA"
"Membranes from bio-based poly(ethylene furanoate) and natural solvents (thymol/vanillin) for phase inversion","09/03/2026 1:00","5","[""Materials & Packaging""]","Malinalli Ramírez-Martínez; Usman T. Syed; Glenda Terán-Cuadrado; Anissa Nurdiawati; Maria Di Vincenzo; Iuliana M. Andrei; Dimitrios N. Bikiaris; Sami G. Al-Ghamdi; Suzana P. Nunes","2026","10.1039/d5gc05422b","https://pubs.rsc.org/en/Content/ArticleLanding/2026/GC/D5GC05422B","[""OPEN""]","Propone fabricar membranas de PEF por inversión de fase usando un sistema solvente natural (thymol/vanillin) y reporta menor impacto climático vs PET comparable (según el estudio).","Conecta PEF con sostenibilidad de proceso (solventes) y aplicaciones de separación/filtración.",""
"Emerging smart packaging materials and technologies for ethylene detection and freshness monitoring","09/03/2026 1:00","4","[""Materials & Packaging""]","Pradeep Kumar; Shefali Tripathi; Ram Kumar Deshmukh; Bhushan P. Meshram; Lavanya; Kirtiraj K. Gaikwad","2026","10.1039/d5fb00379b","https://pubs.rsc.org/en/content/articlehtml/2026/fb/d5fb00379b","[""OPEN""]","Reviews smart packaging technologies for real-time freshness monitoring and ethylene detection; covers colorimetric indicators, biosensors, RFID/NFC integration, and emerging sensing materials.","Directly relevant to active/smart packaging roadmap for beer and beverage freshness assurance; identifies sensor technologies compatible with food-contact packaging.","JORDI ROYES BUISAN"
"A review of innovative approaches for valorizing brewing by-products for food applications and consumer perceptions","09/03/2026 15:18","3","[""Byproducts & Circularity""]","A. Halahlah; A. Kellil; S. Peltonen; T. M. Ho","2026","10.1039/d5fb00545k","https://pubs.rsc.org/en/content/articlelanding/2026/fb/d5fb00545k","[""OPEN""]","Reviews recent extraction, bioprocessing and product development strategies to incorporate brewing solid by-products (BSG, BSY, spent hops) into food, and evaluates consumer perception factors influencing market acceptance.","Bridges the gap between technical valorization advances and market viability by incorporating consumer-acceptance data alongside processing innovation for brewing by-products.","PABLO TEJERO TRAPIELLA"
"Alternative Configurations for the Intensification of the Anaerobic Digestion Process: A Comprehensive Review","09/03/2026 1:00","2","[""Water & Environment""]","Juan García Rodríguez (et al.)","2026","10.3390/pr14040695","https://www.mdpi.com/2227-9717/14/4/695","[""OPEN""]","Reviews alternative configurations for intensifying anaerobic digestion: thermophilic, two-stage acid/gas, temperature-phased, and multi-stage systems; covers mechanisms, key factors, and scalability.","Framework for evaluating AD intensification options for brewery wastewater and BSG co-digestion; two-stage and temperature-phased designs are directly transferable to medium-scale brewery biogas.","RUBEN VERA DOMINGO"
"UK land use implications of replacing dairy farming with precision fermentation","09/03/2026 1:00","1","[""Materials & Packaging""]","Jade A. Warren; E. R. Fonseca; H. Woodward","2026","10.2903/j.efsa.2026.9936","https://efsa.onlinelibrary.wiley.com/doi/10.2903/j.efsa.2026.9936","[""OPEN""]","Quantifies land-use implications of scaling precision-fermented dairy protein in the UK, estimating up to 96 % lower land footprint vs. cow's milk and modelling 20–100 % replacement scenarios for 2050.","Provides macro-level sustainability evidence for PF ingredients; relevant to breweries evaluating PF-derived adjuncts or dairy-alternative functional beverages as part of ESG strategy.","PABLO TEJERO TRAPIELLA"
"Toward a digital twin for beer quality control: development of a digital model integrating industrial process data and model-based fermentation descriptors","26/03/2026 16:30","","[""Analytics & Digital"",""Brewing & Process""]","Colomba Dazzarola; Ronald Tighe; José R. Pérez-Correa; Pedro A. Saa","2026","10.1016/j.jfoodeng.2025.112726","https://doi.org/10.1016/j.jfoodeng.2025.112726","[""PAYWALL""]","Presents a hybrid digital model for beer quality prediction that combines industrial process data, a dynamic fermentation model and machine-learning classifiers. The system identified wort preparation and yeast handling as critical drivers of final quality attributes.","Useful for building process-control and prediction layers linking fermentation signals to beer quality, defects and corrective actions in production.",""
"In vitro protein digestibility and protein quality assessment of novel brewers' spent grain protein isolates","26/03/2026 16:30","","[""Byproducts & Circularity""]","Arianna Ressa; Laura Nyhan; Rosa Sanchez; Dustie N. Lombardi; Patrick O'Riordan; Elke K. Arendt","2026","10.1016/j.ifset.2026.104482","https://doi.org/10.1016/j.ifset.2026.104482","[""OPEN""]","Assesses digestibility and DIAAS of two upcycled brewers' spent grain protein ingredients versus pea, soy and whey isolates using the INFOGEST model. Both ingredients showed high digestibility, but decolourisation appeared to reduce protein quality.","Helps judge whether BSG protein isolates are viable ingredients for nutrition-led products and where processing may erode functional or nutritional value.",""
"Extraction of proteins from brewer's spent grain using ultrasound and alkaline hydrogen peroxide: Impact on extraction yield, structural and techno-functional properties","26/03/2026 16:30","","[""Byproducts & Circularity"",""Biotech applied""]","Marcio Augusto Ribeiro-Sanches; Sérgio Luís Ferreira Júnior; Caroline Santezi; Ícaro Putinhon Caruso; Pedro Esteves Duarte Augusto; Javier Telis-Romero; Tiago Carregari Polachini","2026","10.1016/j.foodhyd.2025.112012","https://doi.org/10.1016/j.foodhyd.2025.112012","[""PAYWALL""]","Evaluates ultrasound and alkaline hydrogen peroxide to intensify protein extraction from brewer's spent grain. The treatments increased extraction yield and improved foaming and emulsifying properties, with trade-offs in color and water-holding capacity depending on the route.","Relevant for designing scalable BSG protein recovery routes and matching extracted fractions to beverage, foam or food-ingredient applications.",""
"Hordein reclaimed from brewer’s spent grains (spent malt) for fabrication of plant oil based pork fat tissue analogues","26/03/2026 16:30","","[""Byproducts & Circularity""]","Wenqing Yang; Xianjian Zeng; Yi Lin; Dejian Huang","2026","10.1016/j.foodhyd.2025.112278","https://doi.org/10.1016/j.foodhyd.2025.112278","[""PAYWALL""]","Reclaims hordein from brewer's spent grain to build emulsion gels that mimic pork fat tissue. The gels showed elastic structure, controlled oil release and cooking losses comparable to pork fat, with post-heating improving texture.","Shows a higher-value route for BSG proteins beyond feed, with relevance for ingredient licensing, co-products and alternative-food partnerships.",""
"Brewers' spent grain reborn via cellulase–xylanase hydrolysis and Lactobacillus acidophilus fermentation and their application in bread","26/03/2026 16:30","","[""Byproducts & Circularity"",""Biotech applied""]","Kexun Liu; Zhengjie Xie; Yan Huang; Huayi Suo; Guohua Zhao; Damao Wang","2026","10.1016/j.ifset.2025.104352","https://doi.org/10.1016/j.ifset.2025.104352","[""PAYWALL""]","Uses cellulase-xylanase hydrolysis followed by Lactobacillus acidophilus fermentation to valorize brewer's spent grain. The treatment improved phenolics, hydration and soluble protein, and enabled bread fortification up to 15% without major sensory penalties.","Demonstrates enzyme-plus-fermentation upgrading of BSG into more functional ingredients, with transferable logic for circular ingredient platforms.",""
"Nitrogen and phosphorus recovery by struvite: From fundamental challenges to engineering strategies","26/03/2026 16:30","","[""Water & Environment""]","Mingye Zhang; Junfeng Liang; Keqiang Zhang; Fuyuan Liu; Xingliang Gao; Zhuowu Li; Yingjun Ma; Xingping Chang; Mengya Wang; Lianzhu Du","2026","10.1016/j.jwpe.2025.109254","https://doi.org/10.1016/j.jwpe.2025.109254","[""PAYWALL""]","Reviews struvite crystallization for simultaneous nitrogen and phosphorus recovery, focusing on pH, magnesium sources, feed variability and scale-up constraints. It also covers contaminant control, pretreatment and process intensification options for industrial deployment.","Frames nutrient-recovery options relevant to brewery effluents and helps assess where struvite could fit as a water-circularity and cost-reduction lever.",""
